<?xml version="1.0" encoding="UTF-8"?>
<tns:UserGroup xmlns:tns="http://www.example.org/User" xmlns:xsi="http://www.w3.org/2001/XMLSchema-instance" xsi:schemaLocation="http://www.example.org/User User.xsd ">
  <tns:users>
    <tns:userId>100</tns:userId>
    <tns:userName>username</tns:userName>
  </tns:users>
  <tns:users>
    <tns:userId>101</tns:userId>
    <tns:userName>username</tns:userName>
  </tns:users>
  <tns:users>
    <tns:userId>102</tns:userId>
    <tns:userName>username</tns:userName>
  </tns:users>
  <tns:users>
    <tns:userId>103</tns:userId>
    <tns:userName>username</tns:userName>
  </tns:users>
</tns:UserGroup>
